{
  "schema_version": "1.0",
  "paper_id": "paper",
  "status": {
    "ran": true,
    "refusal_subtype": null,
    "wall_seconds": 0.27,
    "detail": "0 distinct guarded fingerprint(s) across 0 match(es) in 4115 words",
    "text_source": "pdf",
    "dictionary_version": "2026.08",
    "dictionary_sha256": "28e3daaf1914e5177ac1a5061192de604a9d028e527f51d3aeb4587b916fbd86",
    "n_fingerprints_loaded": 51,
    "n_words_scanned": 4115,
    "families_fired": []
  },
  "result": {
    "success": true,
    "severity": "consistent",
    "consistent": true,
    "matches": [],
    "n_matches": 0,
    "n_matches_body": 0,
    "n_matches_references": 0,
    "n_distinct_fingerprints": 0,
    "n_distinct_fingerprints_solid": 0,
    "per_family": {},
    "n_words_scanned": 4115,
    "density_per_10k_words": 0.0,
    "references_delimited": true,
    "severity_raw_by_family": {
      "tortured_phrase": "consistent",
      "llm_boilerplate": "consistent"
    },
    "paper_discusses_llms": false,
    "metadiscussion_context": false,
    "text_source": "pdf",
    "dictionary": {
      "version": "2026.08",
      "sha256": "28e3daaf1914e5177ac1a5061192de604a9d028e527f51d3aeb4587b916fbd86",
      "n_fingerprints": 51,
      "per_family": {
        "tortured_phrase": 31,
        "llm_boilerplate": 14,
        "tortured_acronym": 6
      },
      "n_blocked": 0,
      "sources": [
        "cabanac2021",
        "curated"
      ]
    },
    "caveats": [
      "a null result is coverage-bounded: the dictionary lists KNOWN fingerprints with a CS/engineering/biomedical skew; absence of matches is not evidence the text is human-written."
    ],
    "explanation": "No fingerprint matches in 4115 words scanned against 51 fingerprints (dictionary 2026.08).",
    "methodology": "Local computation only -- no network, no model. Dictionary fingerprint matching (case/hyphenation/ligature/plural-folded token match) over the paper's extracted text; references-section matches recorded but excluded from severity. A hit asserts the phrase appears -- the inference to paraphrase-tool or undisclosed-LLM use is probabilistic. Coverage is the dictionary's (skewed CS/engineering/biomedical): a clean result on an out-of-field or non-English paper is weak clearance."
  },
  "findings_rows": []
}